OpenROAD 4a99e88667b0840531ca0096c4fa0da8f80d6cb1 
This program is licensed under the BSD-3 license. See the LICENSE file for details.
Components of this program may be licensed under more restrictive licenses which must be honored.
[INFO ODB-0222] Reading LEF file: /openlane/designs/iiitb_icg/runs/RUN_2022.08.29_09.16.35/tmp/merged.nom.lef
[WARNING ODB-0220] WARNING (LEFPARS-2036): SOURCE statement is obsolete in version 5.6 and later.
The LEF parser will ignore this statement.
To avoid this warning in the future, remove this statement from the LEF file with version 5.6 or later. See file /openlane/designs/iiitb_icg/runs/RUN_2022.08.29_09.16.35/tmp/merged.nom.lef at line 930.

[INFO ODB-0223]     Created 13 technology layers
[INFO ODB-0224]     Created 25 technology vias
[INFO ODB-0225]     Created 442 library cells
[INFO ODB-0226] Finished LEF file:  /openlane/designs/iiitb_icg/runs/RUN_2022.08.29_09.16.35/tmp/merged.nom.lef
[INFO ODB-0127] Reading DEF file: /openlane/designs/iiitb_icg/runs/RUN_2022.08.29_09.16.35/tmp/routing/19-fill.def
[INFO ODB-0128] Design: iiitb_icg
[INFO ODB-0130]     Created 8 pins.
[INFO ODB-0131]     Created 130 components and 533 component-terminals.
[INFO ODB-0132]     Created 2 special nets and 490 connections.
[INFO ODB-0133]     Created 23 nets and 43 connections.
[INFO ODB-0134] Finished DEF file: /openlane/designs/iiitb_icg/runs/RUN_2022.08.29_09.16.35/tmp/routing/19-fill.def
[INFO ORD-0030] Using 2 thread(s).
[INFO DRT-0149] Reading tech and libs.

Units:                1000
Number of layers:     13
Number of macros:     442
Number of vias:       25
Number of viarulegen: 25

[INFO DRT-0150] Reading design.

Design:                   iiitb_icg
Die area:                 ( 0 0 ) ( 43265 53985 )
Number of track patterns: 12
Number of DEF vias:       4
Number of components:     130
Number of terminals:      8
Number of snets:          2
Number of nets:           23

[INFO DRT-0167] List of default vias:
  Layer mcon
    default via: L1M1_PR
  Layer via
    default via: M1M2_PR
  Layer via2
    default via: M2M3_PR
  Layer via3
    default via: M3M4_PR
  Layer via4
    default via: M4M5_PR
[INFO DRT-0162] Library cell analysis.
[INFO DRT-0163] Instance analysis.
[INFO DRT-0164] Number of unique instances = 31.
[INFO DRT-0168] Init region query.
[INFO DRT-0024]   Complete FR_MASTERSLICE.
[INFO DRT-0024]   Complete FR_VIA.
[INFO DRT-0024]   Complete li1.
[INFO DRT-0024]   Complete mcon.
[INFO DRT-0024]   Complete met1.
[INFO DRT-0024]   Complete via.
[INFO DRT-0024]   Complete met2.
[INFO DRT-0024]   Complete via2.
[INFO DRT-0024]   Complete met3.
[INFO DRT-0024]   Complete via3.
[INFO DRT-0024]   Complete met4.
[INFO DRT-0024]   Complete via4.
[INFO DRT-0024]   Complete met5.
[INFO DRT-0033] FR_MASTERSLICE shape region query size = 0.
[INFO DRT-0033] FR_VIA shape region query size = 0.
[INFO DRT-0033] li1 shape region query size = 1252.
[INFO DRT-0033] mcon shape region query size = 1514.
[INFO DRT-0033] met1 shape region query size = 376.
[INFO DRT-0033] via shape region query size = 240.
[INFO DRT-0033] met2 shape region query size = 148.
[INFO DRT-0033] via2 shape region query size = 192.
[INFO DRT-0033] met3 shape region query size = 146.
[INFO DRT-0033] via3 shape region query size = 192.
[INFO DRT-0033] met4 shape region query size = 96.
[INFO DRT-0033] via4 shape region query size = 32.
[INFO DRT-0033] met5 shape region query size = 48.
[INFO DRT-0165] Start pin access.
[INFO DRT-0078]   Complete 29 pins.
[INFO DRT-0081]   Complete 23 unique inst patterns.
[INFO DRT-0084]   Complete 19 groups.
#scanned instances     = 130
#unique  instances     = 31
#stdCellGenAp          = 399
#stdCellValidPlanarAp  = 0
#stdCellValidViaAp     = 208
#stdCellPinNoAp        = 0
#stdCellPinCnt         = 43
#instTermValidViaApCnt = 0
#macroGenAp            = 0
#macroValidPlanarAp    = 0
#macroValidViaAp       = 0
#macroNoAp             = 0
[INFO DRT-0166] Complete pin access.
[INFO DRT-0267] cpu time = 00:00:01, elapsed time = 00:00:00, memory = 99.75 (MB), peak = 99.75 (MB)

Number of guides:     112

[INFO DRT-0169] Post process guides.
[INFO DRT-0176] GCELLGRID X 0 DO 6 STEP 6900 ;
[INFO DRT-0177] GCELLGRID Y 0 DO 7 STEP 6900 ;
[INFO DRT-0028]   Complete FR_MASTERSLICE.
[INFO DRT-0028]   Complete FR_VIA.
[INFO DRT-0028]   Complete li1.
[INFO DRT-0028]   Complete mcon.
[INFO DRT-0028]   Complete met1.
[INFO DRT-0028]   Complete via.
[INFO DRT-0028]   Complete met2.
[INFO DRT-0028]   Complete via2.
[INFO DRT-0028]   Complete met3.
[INFO DRT-0028]   Complete via3.
[INFO DRT-0028]   Complete met4.
[INFO DRT-0028]   Complete via4.
[INFO DRT-0028]   Complete met5.
[INFO DRT-0178] Init guide query.
[INFO DRT-0035]   Complete FR_MASTERSLICE (guide).
[INFO DRT-0035]   Complete FR_VIA (guide).
[INFO DRT-0035]   Complete li1 (guide).
[INFO DRT-0035]   Complete mcon (guide).
[INFO DRT-0035]   Complete met1 (guide).
[INFO DRT-0035]   Complete via (guide).
[INFO DRT-0035]   Complete met2 (guide).
[INFO DRT-0035]   Complete via2 (guide).
[INFO DRT-0035]   Complete met3 (guide).
[INFO DRT-0035]   Complete via3 (guide).
[INFO DRT-0035]   Complete met4 (guide).
[INFO DRT-0035]   Complete via4 (guide).
[INFO DRT-0035]   Complete met5 (guide).
[INFO DRT-0036] FR_MASTERSLICE guide region query size = 0.
[INFO DRT-0036] FR_VIA guide region query size = 0.
[INFO DRT-0036] li1 guide region query size = 37.
[INFO DRT-0036] mcon guide region query size = 0.
[INFO DRT-0036] met1 guide region query size = 31.
[INFO DRT-0036] via guide region query size = 0.
[INFO DRT-0036] met2 guide region query size = 18.
[INFO DRT-0036] via2 guide region query size = 0.
[INFO DRT-0036] met3 guide region query size = 2.
[INFO DRT-0036] via3 guide region query size = 0.
[INFO DRT-0036] met4 guide region query size = 0.
[INFO DRT-0036] via4 guide region query size = 0.
[INFO DRT-0036] met5 guide region query size = 0.
[INFO DRT-0179] Init gr pin query.
[INFO DRT-0245] skipped writing guide updates to database.
[INFO DRT-0185] Post process initialize RPin region query.
[INFO DRT-0181] Start track assignment.
[INFO DRT-0184] Done with 55 vertical wires in 1 frboxes and 33 horizontal wires in 1 frboxes.
[INFO DRT-0186] Done with 7 vertical wires in 1 frboxes and 1 horizontal wires in 1 frboxes.
[INFO DRT-0182] Complete track assignment.
[INFO DRT-0267] cpu time = 00:00:00, elapsed time = 00:00:00, memory = 100.44 (MB), peak = 100.44 (MB)
[INFO DRT-0187] Start routing data preparation.
[INFO DRT-0267] cpu time = 00:00:00, elapsed time = 00:00:00, memory = 100.49 (MB), peak = 100.49 (MB)
[INFO DRT-0194] Start detail routing.
[INFO DRT-0195] Start 0th optimization iteration.
    Completing 10% with 0 violations.
    elapsed time = 00:00:00, memory = 108.71 (MB).
[INFO DRT-0199]   Number of violations = 0.
[INFO DRT-0267] cpu time = 00:00:00, elapsed time = 00:00:00, memory = 108.66 (MB), peak = 463.45 (MB)
Total wire length = 267 um.
Total wire length on LAYER li1 = 0 um.
Total wire length on LAYER met1 = 90 um.
Total wire length on LAYER met2 = 158 um.
Total wire length on LAYER met3 = 17 um.
Total wire length on LAYER met4 = 0 um.
Total wire length on LAYER met5 = 0 um.
Total number of vias = 88.
Up-via summary (total 88):.

---------------------
 FR_MASTERSLICE     0
            li1    43
           met1    43
           met2     2
           met3     0
           met4     0
---------------------
                   88


[INFO DRT-0198] Complete detail routing.
Total wire length = 267 um.
Total wire length on LAYER li1 = 0 um.
Total wire length on LAYER met1 = 90 um.
Total wire length on LAYER met2 = 158 um.
Total wire length on LAYER met3 = 17 um.
Total wire length on LAYER met4 = 0 um.
Total wire length on LAYER met5 = 0 um.
Total number of vias = 88.
Up-via summary (total 88):.

---------------------
 FR_MASTERSLICE     0
            li1    43
           met1    43
           met2     2
           met3     0
           met4     0
---------------------
                   88


[INFO DRT-0267] cpu time = 00:00:00, elapsed time = 00:00:00, memory = 108.66 (MB), peak = 463.45 (MB)

[INFO DRT-0180] Post processing.
Saving to /openlane/designs/iiitb_icg/runs/RUN_2022.08.29_09.16.35/results/routing/iiitb_icg.def
